{
  "schema_version": 1,
  "corpus_id": "CORPUS-V1.13-POST-REMEDIATION-20260719",
  "version": "1.0.0",
  "provenance": {
    "corpus_hash": "e6cc1924a19389c6aaa7aec4c8bf8d7eea233a8cc8caa1ccd1564eecf698ca05",
    "corpus_created_at": "2026-07-19T16:33:20Z",
    "collection_started_at": "2026-07-19T16:21:40Z",
    "collection_ended_at": "2026-07-19T16:29:27Z"
  },
  "evaluation_design": {
    "mode": "sample",
    "population_definition": "The same 22 predeclared detector cases from the v1.12.0 field-validation cohort, re-evaluated with Citable v1.13.0 after resource-applicability remediation.",
    "selection_method": "Paired re-evaluation of every previously disclosed case against fresh owner-authorized URL audits from clean release-preparation commit 709c8e81a14cdaf3d68bc9191b281b9c70bd88ea.",
    "sampling_plan_ref": "CORPUS/SAMPLING-PLAN",
    "inclusion_criteria": [
      "Every critical or high finding emitted by the selected acceptance run for each property.",
      "Four deterministic negative-control cases on an observed HTTP 200 HTML homepage."
    ],
    "exclusion_criteria": [
      "No additional medium or low findings were adjudicated.",
      "Semantic findings remain excluded because two independent reviewers were not available.",
      "Sitemap URLs beyond the unchanged 50-page crawl ceiling remain outside adjudication."
    ],
    "extrapolation_limits": [
      "Metrics apply only to these paired cases, properties, Citable v1.13.0, and the disclosed collection window.",
      "Absence of the 17 prior false-positive detector/subject pairs does not estimate detector accuracy outside this cohort.",
      "Owner collection and adjudication are not independent validation."
    ],
    "collection_started_at": "2026-07-19T16:21:40Z",
    "collection_ended_at": "2026-07-19T16:29:27Z"
  },
  "population": {
    "properties": 4,
    "detector_cases": 22,
    "semantic_reviews": 0,
    "executions": 4,
    "remediation_verifications": 3
  },
  "detector_versions": {
    "versions": [
      "1.13.0"
    ],
    "mixed_versions": false,
    "cases_by_version": {
      "1.13.0": {
        "true_positive": 0,
        "false_positive": 0,
        "true_negative": 21,
        "false_negative": 0,
        "incomplete": 1,
        "evaluated": 21,
        "precision": null,
        "recall": null,
        "false_positive_rate": 0,
        "discovered_false_negative_rate": null,
        "incomplete_rate": 0.045454545454545456
      }
    }
  },
  "detector_accuracy": {
    "overall": {
      "true_positive": 0,
      "false_positive": 0,
      "true_negative": 21,
      "false_negative": 0,
      "incomplete": 1,
      "evaluated": 21,
      "precision": null,
      "recall": null,
      "false_positive_rate": 0,
      "discovered_false_negative_rate": null,
      "incomplete_rate": 0.045454545454545456
    },
    "by_namespace": {
      "PAGE": {
        "true_positive": 0,
        "false_positive": 0,
        "true_negative": 7,
        "false_negative": 0,
        "incomplete": 0,
        "evaluated": 7,
        "precision": null,
        "recall": null,
        "false_positive_rate": 0,
        "discovered_false_negative_rate": null,
        "incomplete_rate": 0
      },
      "TECH": {
        "true_positive": 0,
        "false_positive": 0,
        "true_negative": 14,
        "false_negative": 0,
        "incomplete": 1,
        "evaluated": 14,
        "precision": null,
        "recall": null,
        "false_positive_rate": 0,
        "discovered_false_negative_rate": null,
        "incomplete_rate": 0.06666666666666667
      }
    }
  },
  "reviewer_metrics": {
    "reviewable_items": 0,
    "exact_agreement_items": 0,
    "exact_agreement_rate": null,
    "adjudicated_items": 0,
    "adjudication_rate": null
  },
  "execution_metrics": {
    "average_runtime_ms": 644260,
    "p95_runtime_ms": 802370,
    "peak_memory_bytes": 171655168,
    "evidence_storage_bytes": 1985626,
    "reproducibility_rate": 0,
    "incomplete_evidence_rate": 0.5
  },
  "remediation_metrics": {
    "evaluated": 3,
    "verified": 3,
    "verification_success_rate": 1,
    "incomplete": 0
  },
  "metric_definitions": {
    "detector_precision": {
      "value": null,
      "numerator": 0,
      "denominator": 0,
      "population": "Adjudicated detector cases with detected outcomes.",
      "exclusions": [
        "Incomplete cases and non-detected outcomes."
      ],
      "confidence_limitations": [
        "Precision applies only to the disclosed expected-case population."
      ]
    },
    "discovered_false_negative_rate": {
      "value": null,
      "numerator": 0,
      "denominator": 0,
      "population": "Adjudicated cases expected to produce a detection.",
      "exclusions": [
        "Unknown and incomplete expected detections."
      ],
      "confidence_limitations": [
        "Unknown false negatives are not quantified; this paired cohort evaluates only the 22 previously disclosed cases.",
        "The unchanged 50-page crawl ceiling left sitemap coverage incomplete on aisyndicate.io and mikeholownych.com."
      ]
    },
    "false_positive_rate": {
      "value": 0,
      "numerator": 0,
      "denominator": 21,
      "population": "Adjudicated cases expected not to produce a detection.",
      "exclusions": [
        "Incomplete cases and expected detections."
      ],
      "confidence_limitations": [
        "Rate applies only to represented non-detection cases."
      ]
    },
    "reviewer_exact_agreement": {
      "value": null,
      "numerator": 0,
      "denominator": 0,
      "population": "Semantic reviews with at least two verdicts.",
      "exclusions": [
        "Reviews with fewer than two verdicts."
      ],
      "confidence_limitations": [
        "Exact agreement does not establish reviewer correctness."
      ]
    },
    "adjudication_rate": {
      "value": null,
      "numerator": 0,
      "denominator": 0,
      "population": "Semantic reviews with at least two verdicts.",
      "exclusions": [
        "Reviews with fewer than two verdicts."
      ],
      "confidence_limitations": [
        "Adjudication rate describes workflow, not semantic accuracy."
      ]
    },
    "average_runtime_ms": {
      "value": 644260,
      "numerator": 2577040,
      "denominator": 4,
      "population": "Recorded corpus executions.",
      "exclusions": [],
      "confidence_limitations": [
        "Runtime depends on disclosed execution environments."
      ]
    },
    "p95_runtime_ms": {
      "value": 802370,
      "numerator": null,
      "denominator": 4,
      "population": "Recorded corpus executions.",
      "exclusions": [],
      "confidence_limitations": [
        "Nearest-rank p95 is unstable for small populations."
      ]
    },
    "peak_memory_bytes": {
      "value": 171655168,
      "numerator": null,
      "denominator": 4,
      "population": "Recorded corpus executions.",
      "exclusions": [],
      "confidence_limitations": [
        "Peak memory is the maximum owner-reported execution value."
      ]
    },
    "evidence_storage_bytes": {
      "value": 1985626,
      "numerator": 1985626,
      "denominator": 4,
      "population": "Recorded corpus executions.",
      "exclusions": [],
      "confidence_limitations": [
        "Storage excludes unavailable or undisclosed evidence."
      ]
    },
    "run_reproducibility": {
      "value": 0,
      "numerator": 0,
      "denominator": 4,
      "population": "Recorded corpus executions.",
      "exclusions": [],
      "confidence_limitations": [
        "Reproducibility is bounded by each run receipt and declared exclusions."
      ]
    },
    "incomplete_evidence_rate": {
      "value": 0.5,
      "numerator": 2,
      "denominator": 4,
      "population": "Recorded corpus executions.",
      "exclusions": [],
      "confidence_limitations": [
        "Incomplete status depends on declared unavailable evidence."
      ]
    },
    "remediation_verification_success": {
      "value": 1,
      "numerator": 3,
      "denominator": 3,
      "population": "Remediation verifications with a completed verdict.",
      "exclusions": [
        "Incomplete verifications."
      ],
      "confidence_limitations": [
        "Verification does not establish external outcome causation."
      ]
    }
  },
  "unknown_false_negatives": {
    "status": "not_quantified",
    "reason": "Cases absent from the disclosed and adjudicated expected-detection population cannot be counted."
  },
  "false_negative_discovery_limitations": [
    "Unknown false negatives are not quantified; this paired cohort evaluates only the 22 previously disclosed cases.",
    "The unchanged 50-page crawl ceiling left sitemap coverage incomplete on aisyndicate.io and mikeholownych.com."
  ],
  "causal_limitations": [
    "The paired result verifies detector-behavior remediation for the disclosed cases; it establishes no causal effect on search, citation, traffic, or conversion outcomes."
  ],
  "limitations": [
    "All collection and adjudication are owner-controlled and are not independent attestation.",
    "Reproducibility was not claimed because the final clean-SHA cohort was collected once per property.",
    "TECH-011 on aisyndicate.io remains incomplete until raw and rendered content are compared and reviewed.",
    "The historical v1.12.0 corpus remains immutable; this is a separate post-remediation cohort."
  ],
  "metrics_hash": "721d2e2707a01bc5580f2d57bc4f3797c79db2c7bb65823f014812abe203e1b7"
}
